{
  "id": "region.main_area",
  "name": "Ashgrove",
  "cellTiles": 256,
  "seamTiles": 16,
  "cells": [
    {
      "x": 0,
      "y": 0,
      "district": "district.town_center"
    },
    {
      "x": 1,
      "y": 0,
      "district": "district.forest_edge"
    },
    {
      "x": 0,
      "y": 1,
      "district": "district.industrial_park"
    },
    {
      "x": 1,
      "y": 1,
      "district": "district.residential_suburb"
    }
  ]
}
